video_id,title,published_date,view_count,like_count,comment_count,duration,tags,category_id,language,channel_id,channel_name
TueRWnp_4ZE,Unlock your vibe with #KismatKiChaabi ❤️‍🔥💎🗝️ Create your own #Shorts & let destiny dance 🎶,2026-01-09T13:01:06Z,55163,370,0,25.0,"kismat ki chaabi shorts,kismat ki chabi,rahu ketu,qismat ki chabi,rahu ketu songs,rahu ketu movie songs,rahu ketu film songs,shalini panday songs,pulkit samrat new songs,varun sharma new songs,new bollywood songs,new hindi songs,vikram montrose new songs,raja kumari songs,party songs,new dance songs,latest party songs,bollywood party songs,new year party songs,new trending song,abhinav shekhar,raja kumari new song,qismat ki chaabi,kismat ki chavi",10,hi,UCFFbwnve3yF62-tVXkTyHqg,Zee Music Company
gFMYkxy0Ei8,"This is not just any sound, ye Dahaad hai 🔥⚔️ #Dahaad OUT NOW #shorts",2026-01-14T08:01:02Z,52325,221,2,33.0,"dahaad shorts,dahaad,dahhad,rahu ketu,qismat ki chabi,rahu ketu songs,rahu ketu movie songs,rahu ketu film songs,shalini panday songs,pulkit samrat new songs,varun sharma new songs,new bollywood songs,new hindi songs,vikram montrose new songs,sukhwinder singh songs,latest party songs,bollywood party songs,new year party songs,new trending song,maar dahad,maar dahaad,new motivational songs,new inspirational song,sukhwinder singh new songs,mar dahad",10,hi,UCFFbwnve3yF62-tVXkTyHqg,Zee Music Company
39LgzSqBUYA,Unlock your vibe with #KismatKiChaabi ❤️‍🔥💎🗝️ Create your own #Shorts & let destiny dance 🎶,2026-01-10T08:00:05Z,96471,699,19,33.0,"kismat ki chaabi shorts,kismat ki chabi,rahu ketu,qismat ki chabi,rahu ketu songs,rahu ketu movie songs,rahu ketu film songs,shalini panday songs,pulkit samrat new songs,varun sharma new songs,new bollywood songs,new hindi songs,vikram montrose new songs,raja kumari songs,party songs,new dance songs,latest party songs,bollywood party songs,new year party songs,new trending song,abhinav shekhar,raja kumari new song,qismat ki chaabi,kismat ki chavi",10,hi,UCFFbwnve3yF62-tVXkTyHqg,Zee Music Company
xX2MIE6IQYk,"One beat, one vibe, endless groove. #Madira TUNE IN NOW ❤‍🔥💥📀 #RahuKetu #Shorts",2026-01-12T04:30:49Z,62728,318,2,31.0,"madira shorts,madira song,madira rahu ketu,madira aisi chad gayi ae,madira aise chad gayi hai,jaise vikram pe betaal,rahu ketu songs,rahu ketu movie songs,rahu ketu film songs,shalini panday songs,pulkit samrat new songs,varun sharma new songs,new bollywood songs,new hindi songs,vikram montrose new songs,simar kaur new songs,new party songs,new dance songs,latest party songs,bollywood party songs,new year party songs,new trending song,madhira,madeera",10,hi,UCFFbwnve3yF62-tVXkTyHqg,Zee Music Company
JqWKQeZ01JE,"When the fight begins, the roar gets louder 🔥👊 #Dahaad out now #shorts",2026-01-15T05:00:32Z,6234,68,2,33.0,"dahaad shorts,dahaad,dahhad,rahu ketu,qismat ki chabi,rahu ketu songs,rahu ketu movie songs,rahu ketu film songs,shalini panday songs,pulkit samrat new songs,varun sharma new songs,new bollywood songs,new hindi songs,vikram montrose new songs,sukhwinder singh songs,latest party songs,bollywood party songs,new year party songs,new trending song,maar dahad,maar dahaad,new motivational songs,new inspirational song,sukhwinder singh new songs,mar dahad",10,hi,UCFFbwnve3yF62-tVXkTyHqg,Zee Music Company
Gklbjla5Yug,Unlock your vibe with #KismatKiChaabi ❤️‍🔥💎🗝️ Create your own #Shorts & let destiny dance 🎶,2026-01-14T07:01:42Z,81579,402,11,32.0,"kismat ki chaabi shorts,kismat ki chabi,rahu ketu,qismat ki chabi,rahu ketu songs,rahu ketu movie songs,rahu ketu film songs,shalini panday songs,pulkit samrat new songs,varun sharma new songs,new bollywood songs,new hindi songs,vikram montrose new songs,raja kumari songs,party songs,new dance songs,latest party songs,bollywood party songs,new year party songs,new trending song,abhinav shekhar,raja kumari new song,qismat ki chaabi,kismat ki chavi",10,hi,UCFFbwnve3yF62-tVXkTyHqg,Zee Music Company
OCV1PuFUWAI,#AshqNaHo #ArijitSingh #AkshayKumar #SonakshiSinha #Holiday #Patriotic #Shorts,2026-01-10T06:00:33Z,120400,2155,24,61.0,"Ashq Na Ho Shorts,Holiday,Ashq Na Ho HD Video,Ashq Na Ho Holiday,Ashq Na Ho Akshay Kumar,Ashq Na Ho Sonkashi Sinha,Ashq Na Ho Arijit Singh,Ashq Na Ho Official HD,Holiday Songs 2014,Bollywood Latest Songs,Arijit Singh,Holiday Pritam,Music Director Pritam,Sonakshi Sinha,Akshay Kumar,Holiday Full Songs,Holiday Jukebox,Pritam,New Song,Patriotic Song,Ashq Na Ho Holiday Official Video,sad song,Naina Ashq Na Ho,Desh Bhakti Songs,New Patriotic Songs",10,hi,UCFFbwnve3yF62-tVXkTyHqg,Zee Music Company
_AV3bC1Dn1Y,#UdiUdiJaye #Raees #ShahRukhKhan #RamSampath #Shorts,2026-01-13T14:03:50Z,99819,1257,13,48.0,"Udi Udi Jaye Shorts,Udi Udi,Udi Udi Jaye,Raees,raees garba,raees song,udi udi song,raees full movie,shah rukh khan,mahira khan,shahrukh khan,shahrukh khan movies,zaalima,raees,Ram Sampath,Shah Rukh Khan songs,shah rukh khan videos,new songs,garba songs,raees full album,Sukhwinder Singh,Bhoomi Trivedi,Karsan Sagathia,Rahul Dholakia,zee music company,makar sankranti,udi udi jaye song,udi udi jaye song shorts,dandiya song,garba song",10,hi,UCFFbwnve3yF62-tVXkTyHqg,Zee Music Company
BT9nCopNGnE,"Priyatama - Lakshmi Niwas | Rajendra C, Manasi J | Sonu Nigam, Soumee Sailsh, Rahul Jain | Zee TV",2026-01-07T12:31:55Z,19005,250,18,190.0,"priyatama video,priyathama,priytama,priyatamaa,priyatama sonu nigam,lakshmi niwas songs,lakshmi niwas,lakshmi niwas serial,lakshmi niwas new promo,new hindi songs,romantic songs,love songs,bollywood love songs,new bollywood songs,rahul jain new songs,rahul jain songs,new serial songs,new trending songs,soumee sailsh songs,lakshmi nivas songs,priyetama,laxmi niwas songs,lakshmi niwas serial song,sonu nigam new songs,sonu nigam songs,sonu nigam song",10,hi,UCFFbwnve3yF62-tVXkTyHqg,Zee Music Company
N4sb5xnWnHE,#UdiUdiJaye #Raees #ShahRukhKhan #RamSampath #Shorts,2026-01-14T01:30:33Z,60879,1088,12,64.0,"Udi Udi Jaye Shorts,Udi Udi,Udi Udi Jaye,Raees,raees garba,raees song,udi udi song,raees full movie,shah rukh khan,mahira khan,shahrukh khan,shahrukh khan movies,zaalima,raees,Ram Sampath,Shah Rukh Khan songs,shah rukh khan videos,new songs,garba songs,raees full album,Sukhwinder Singh,Bhoomi Trivedi,Karsan Sagathia,Rahul Dholakia,zee music company,makar sankranti,udi udi jaye song,udi udi jaye song shorts,dandiya song,garba song",10,hi,UCFFbwnve3yF62-tVXkTyHqg,Zee Music Company
X-NdZzBfteg,#Jugraafiya #Super30 #HrithikRoshan #MrunalThakur #UditNarayan #ShreyaGhoshal #Shorts,2026-01-10T12:52:27Z,262889,2119,11,61.0,"Jugraafiya Shorts,super 30 songs,Jugrafiya super30,Gujrafiya,Hrithik Roshan Songs,Udit Narayan Songs,Shreya Ghosal Songs,Ajay Atul Songs,Hrithik Roshan New Songs,New Songs Hindi,Hindi Songs,Super 30 Hindi Songs,Shreya Ghosal New Songs,Ajay Atul Hindi Songs,Geography Song,Romantic Songs,Love Songs,hrithik roshan,udit narayan songs,udit narayan,shreya ghoshal,shreya ghoshal songs,ajay atul,ajay atul new song,jugrafiya,hindi songs,jugrafiyaa shorts",10,hi,UCFFbwnve3yF62-tVXkTyHqg,Zee Music Company
7Qvk7CLUoj4,"Best of Shashwat Sachdev | Challa, O Shera, Jagga Jiteya, Ik Tu Hai, Jigra, Cyclone, Jaan Da & More",2026-01-08T02:30:09Z,41597,282,14,7213.0,"best of shashwat sachdev,shashwat sachdev new songs,shashwat sachdev songs,shashwat sachdev jukebox,shashwat sachdev,shashwat sachdev all songs,kesari 2 songs,veere di wedding songs,attack movie songs,tejas songs,new hindi songs,new love songs,new motivational songs,new bollywood songs,bollywood hits,jigra,challa,o shera,ik tu hai,uri songs,uri movie songs,vicky kaushal songs,patriotic songs,jagga jiteya,new patriotic songs,latest patriotic songs",10,hi,UCFFbwnve3yF62-tVXkTyHqg,Zee Music Company
K0dPLogOhY0,MC Sher in his soft boy era #SiddhantChaturvedi #TriptiiDimri #OnSetOffScript #shorts,2026-01-10T09:00:35Z,27176,248,5,41.0,"triptii dimri podcast new,triptii dimri interview,triptii dimri podcast,dhadak 2 podcast,triptii dimri new podcast,hindi podcast,triptii dimri movies,triptii dimri songs,on set off script,behind the scenes,bollywood buzz,celebrity interview,triptii dimri latest interview,siddhant chaturvedi podcast,siddhant chaturvedi interview,siddhant chaturvedi songs,siddhant chaturvedi and triptii dimri,podcast new,hindi podcast channel,podcasts to listen to,shorts",10,hi,UCFFbwnve3yF62-tVXkTyHqg,Zee Music Company
Xwhw76Hm3lo,This is what love sounds like… #PreetRe 🎶🤍 #Dhadak2 #SiddhantChaturvedi #TriptiiDimri #shorts,2026-01-12T07:00:25Z,39711,394,6,60.0,"preet re shorts,preet re dhadak 2,preet re song,prit re,darshan raval,preet re new song,preet re,jonita gandhi,tere sang lagi jo preet re,dhadak 2 songs,dhadak 2 movie songs,dhadak 2 film songs,siddhant chaturvedi new songs,triptii dimri new songs,dhadak 2 tripti dimri,new hindi songs,new bollywood songs,new love songs,new romantic songs,darshan raval new song,jonita gandhi songs,rochak kohli songs,trending songs,tere sang lagi preet re,preet",10,hi,UCFFbwnve3yF62-tVXkTyHqg,Zee Music Company
tTDGPf3sb6E,🎙️ Unfiltered talks & on-set stories with the #RahuKetu crew. Full episode dropping soon! 🎬 #shorts,2026-01-14T11:28:42Z,24331,148,3,60.0,"rahu ketu podcast,varun sharma podcast,pulkit samrat podcast,varun sharma pulkit samrat,rahu ketu interview,on set off script,rahu ketu cast interview,bollywood podcast,bollywood actor interview,zee music company podcast,rahuketu movie,varun sharma interview,pulkit samrat interview,bollywood behind the scenes,bollywood on set stories,celebrity podcast india,bollywood podcast shorts,rahuketu promotion,varun sharma funny,pulkit samrat candid interview",10,hi,UCFFbwnve3yF62-tVXkTyHqg,Zee Music Company
xYLnk0F-TBU,"Rahu Ketu rise, and belief roars louder 🔥🙏#JeRahuKetuKaunHain - TUNE IN NOW #shorts",2026-01-08T08:01:18Z,110294,615,4,33.0,"je rahu ketu kaun hain shorts,asal cheez tera karam hai pyaar,yeh rahu ketu kaun hain,rahu ketu kaun hain,rahu ketu,rahu ketu song,rahu ketu movie songs,rahu ketu film songs,pulkit samrat new songs,varun sharma new songs,new bollywood songs,new hindi songs,new fun songs,new trending song,piyush mishra songs,rahu ketu story,tarsh srivastava,amitosh nagpal,rahu ketu new songs,varun sharma songs,pulkit samrat songs,rahu ketu movie,rahu aur ketu kaun hai",10,hi,UCFFbwnve3yF62-tVXkTyHqg,Zee Music Company
NirNKpdM2yg,#Nazdeekiyaan #Shaandaar #ShahidKapoor #AliaBhatt #AmitTrivedi #NeetiMohan #NikhilPaulGeorge #shorts,2026-01-13T13:29:23Z,29053,213,1,57.0,"nazdeekiyaan shorts,nazdeekiyaan full video,nazdeekiyaan shaandaar,shaandaar movie songs,nazdeekiyaan,shahid kapoor songs,alia bhatt songs,shahid kapoor alia bhatt song,nazdeekiyaan lyrics,nazdeekiyaan romantic song,bollywood romantic songs,hindi love songs,romantic songs,romantic hindi songs,soulful bollywood songs,nazdeekiyaan hd video,nazdeekiyaan official video,best romantic bollywood songs,hindi romantic songs,nazdikiyan,nazdikeeyan,shahid songs",10,hi,UCFFbwnve3yF62-tVXkTyHqg,Zee Music Company
yusuAU2z5Ew,#Waareya #SurajPeMangalBhari #DiljitDosanjh #FatimaSanaShaikh #PalakMuchhal #VibhorParashar #shorts,2026-01-10T04:01:04Z,25074,221,2,58.0,"wareya shorts,Waareya song,wareya song,waareya by palak,waariyan by palak muchhal,waariyan song,waariyan,waareya female version,waariyan lyrical song,diljit dosanjh,suraj pe mangal bhari,diljit dosanjh new song,palak muchhal songs,palak muchhal,palak muchhal new song,waariyan full song,new romantic song,romantic song,diljit and fatima song,2024 romantic songs,hindi romantic songs,latest bollywood songs,palak muchhal new songs,new love songs",10,hi,UCFFbwnve3yF62-tVXkTyHqg,Zee Music Company
4uQfQwFFI0Y,#Nazdeekiyaan #Shaandaar #ShahidKapoor #AliaBhatt #AmitTrivedi #NeetiMohan #NikhilPaulGeorge #shorts,2026-01-14T10:00:07Z,27990,314,1,36.0,"nazdeekiyaan shorts,nazdeekiyaan full video,nazdeekiyaan shaandaar,shaandaar movie songs,nazdeekiyaan,shahid kapoor songs,alia bhatt songs,shahid kapoor alia bhatt song,nazdeekiyaan lyrics,nazdeekiyaan romantic song,bollywood romantic songs,hindi love songs,romantic songs,romantic hindi songs,soulful bollywood songs,nazdeekiyaan hd video,nazdeekiyaan official video,best romantic bollywood songs,hindi romantic songs,nazdikiyan,nazdikeeyan,shahid songs",10,hi,UCFFbwnve3yF62-tVXkTyHqg,Zee Music Company
vyCtOFlylAU,#JeRahuKetuKaunHain #RahuKetu #PulkitSamrat #VarunSharma #PiyushMishra #TarshSrivastava #shorts,2026-01-10T05:01:11Z,63137,604,5,59.0,"je rahu ketu kaun hain shorts,asal cheez tera karam hai pyaar,yeh rahu ketu kaun hain,rahu ketu kaun hain,rahu ketu,rahu ketu song,rahu ketu movie songs,rahu ketu film songs,pulkit samrat new songs,varun sharma new songs,new bollywood songs,new hindi songs,new fun songs,new trending song,piyush mishra songs,rahu ketu story,tarsh srivastava,amitosh nagpal,rahu ketu new songs,varun sharma songs,pulkit samrat songs,rahu ketu movie,rahu aur ketu kaun hai",10,hi,UCFFbwnve3yF62-tVXkTyHqg,Zee Music Company
tDyTgMh78L8,"Hope you feel good about yourself, Austin Theory...",2026-01-06T21:15:24Z,3775839,65175,312,38.0,"wrestling,submission wrestling,wwe,professional wrestling,Combat Sport,finishing moves,कुश्ती,पहलवान,डब्लू डब्लू ई,मैच,सुपरस्टार,व्यावसायिक कुश्ती,مصارعه",17,en,UCJ5v_MCY6GNUBTO8-D3XoAg,WWE
7wHSX9DMxEQ,WHAT A BOOT 💥,2026-01-03T17:00:12Z,765975,13470,221,12.0,"wrestling,submission wrestling,wwe,professional wrestling,Combat Sport,finishing moves,कुश्ती,पहलवान,डब्लू डब्लू ई,मैच,सुपरस्टार,व्यावसायिक कुश्ती,مصارعه,Smackdown clips,smackdown highlights,smackdown winners,wwe smackdown highlights today,smackdown tonight,friday night smackdown,wwe smackdown,smackdown 2026,smack downs highlights,lash legend,iyo sky",17,en,UCJ5v_MCY6GNUBTO8-D3XoAg,WWE
x9v6hZ9D4SU,"Raquel Rodriguez unleashes a backstage assault on Stephanie Vaquer: Raw highlights, Jan. 5, 2026",2026-01-06T02:57:10Z,200106,5117,625,57.0,"Raquel Rodriguez,Stephanie Vaquer,superstars,world wrestling entertainment,wrestle,wrestler,wrestling,wwe,wwe 2026,مصارعه,कुश्ती,डब्लू डब्लू ई,पहलवान,मैच,व्यावसायिक कुश्ती,सुपरस्टार,Raw clips,raw videos,raw highlights,raw winners,monday night raw clips,monday night raw highlights,raw tonight,raw match card,raw highlights this week,WWE on Netflix,WWE Raw on Netflix,Raw on Netflix",17,en,UCJ5v_MCY6GNUBTO8-D3XoAg,WWE
b-qDHNjO8pM,RHIYO FOREVER 🖤 Congratulations to the NEW Women's Tag Team Champions!,2026-01-07T18:25:52Z,246563,8062,142,31.0,"wrestling,submission wrestling,wwe,professional wrestling,Combat Sport,finishing moves,कुश्ती,पहलवान,डब्लू डब्लू ई,मैच,सुपरस्टार,व्यावसायिक कुश्ती,مصارعه",17,en,UCJ5v_MCY6GNUBTO8-D3XoAg,WWE
KBLqgx1u-io,Slapped the smile right off his face! 👋😄,2026-01-07T15:42:32Z,3113934,53437,441,21.0,"wrestling,submission wrestling,wwe,professional wrestling,Combat Sport,finishing moves,कुश्ती,पहलवान,डब्लू डब्लू ई,मैच,सुपरस्टार,व्यावसायिक कुश्ती,مصارعه",17,en,UCJ5v_MCY6GNUBTO8-D3XoAg,WWE
nZzGCE1R1cc,"With some help from Fatal Influence, Jacy Jayne is STILL your #WWENXT Women’s Champion! 🏆",2026-01-07T02:08:14Z,992319,11344,86,57.0,"wrestling,submission wrestling,wwe,professional wrestling,Combat Sport,finishing moves,कुश्ती,पहलवान,डब्लू डब्लू ई,मैच,सुपरस्टार,व्यावसायिक कुश्ती,مصارعه",17,en,UCJ5v_MCY6GNUBTO8-D3XoAg,WWE
geXPu5DjRt4,"CM Punk vs. Bron Breakker | World Heavyweight Title Match: Raw highlights, Jan. 5, 2026",2026-01-06T04:21:47Z,889851,19795,1454,199.0,"Bron Breakker,CM Punk,Paul Heyman,superstars,world wrestling entertainment,wrestle,wrestler,wrestling,wwe,wwe 2026,مصارعه,कुश्ती,डब्लू डब्लू ई,पहलवान,मैच,व्यावसायिक कुश्ती,सुपरस्टार,Raw clips,raw videos,raw highlights,raw winners,monday night raw clips,monday night raw highlights,raw tonight,raw match card,raw highlights this week,WWE on Netflix,WWE Raw on Netflix,Raw on Netflix",17,en,UCJ5v_MCY6GNUBTO8-D3XoAg,WWE
aUKa9x5JqjA,Meet NXT’s Elio LeFleur: NXT New Year’s Evil 2026 highlights,2026-01-07T01:50:05Z,54059,2328,322,60.0,"Elio LeFleur,superstars,world wrestling entertainment,wrestle,wrestler,wrestling,wwe,wwe 2026,مصارعه,कुश्ती,डब्लू डब्लू ई,पहलवान,मैच,व्यावसायिक कुश्ती,सुपरस्टार,WWE NXT,NXT clips,NXT highlights,nxt winners,nxt match card,nxt tonight,nxt tuesday 2025,nxt recap,nxt champion,nxt news,nxt tuesday,nxt highlights this week",17,en,UCJ5v_MCY6GNUBTO8-D3XoAg,WWE
a-ZzyGACG3I,BANNED FROM THE BUILDING?! 😳 #NewYearsEvil,2026-01-07T01:36:57Z,288198,10791,219,43.0,"wrestling,submission wrestling,wwe,professional wrestling,Combat Sport,finishing moves,कुश्ती,पहलवान,डब्लू डब्लू ई,मैच,सुपरस्टार,व्यावसायिक कुश्ती,مصارعه",17,en,UCJ5v_MCY6GNUBTO8-D3XoAg,WWE
lER26t7Jo6U,"Raquel Rodriguez attacks Stephanie Vaquer’s injured ankle: Raw highlights, Jan. 5, 2026",2026-01-06T02:55:39Z,227641,6408,642,209.0,"Kelly Kincaid,Raquel Rodriguez,Stephanie Vaquer,superstars,world wrestling entertainment,wrestle,wrestler,wrestling,wwe,wwe 2026,مصارعه,कुश्ती,डब्लू डब्लू ई,पहलवान,मैच,व्यावसायिक कुश्ती,सुपरस्टार,Raw clips,raw videos,raw highlights,raw winners,monday night raw clips,monday night raw highlights,raw tonight,raw match card,raw highlights this week,WWE on Netflix,WWE Raw on Netflix,Raw on Netflix",17,en,UCJ5v_MCY6GNUBTO8-D3XoAg,WWE
nvMmBGiPCbI,"Top 10 Raw moments: WWE Top 10, Jan. 5, 2026",2026-01-06T20:00:57Z,522710,9971,397,641.0,"Adam Pearce,Bayley,Corey Graves,Je'Von Evans,Kabuki Warriors,Liv Morgan,Lyra Valkyria,Michael Cole,Penta,Rey Mysterio,Roxanne Perez,The Vision,superstars,world wrestling entertainment,wwe,wwe 2026,مصارعه,डब्लू डब्लू ई,पहलवान,व्यावसायिक कुश्ती,Raw clips,raw videos,raw highlights,raw winners,monday night raw clips,monday night raw highlights,raw tonight,raw match card,raw highlights this week,WWE on Netflix,WWE Raw on Netflix,Raw on Netflix",17,en,UCJ5v_MCY6GNUBTO8-D3XoAg,WWE
ewn70oywre4,Randy Orton attacks out of nowhere: WWE Playlist,2026-01-08T13:01:19Z,311016,5640,232,1992.0,"Brock Lesnar,Dirty Dominik Mysterio,Drew McIntyre,JD McDonagh,Jeff Hardy,Matt Hardy,Paul Heyman,Randy Orton,Rhea Ripley,Shane Helms,Shinsuke Nakamura,superstars,world wrestling entertainment,wrestle,wrestler,wrestling,wwe,wwe 2026,مصارعه,कुश्ती,डब्लू डब्लू ई,पहलवान,मैच,व्यावसायिक कुश्ती,सुपरस्टार",17,en,UCJ5v_MCY6GNUBTO8-D3XoAg,WWE
vIE5bfZdPM4,"FULL MATCH: Jey Uso vs. Drew McIntyre: Raw on Netflix premiere, Jan. 6, 2025",2026-01-09T14:01:39Z,282795,6390,248,1084.0,"Drew McIntyre,Jey Uso,Travis Scott,superstars,world wrestling entertainment,wrestle,wrestler,wrestling,wwe,wwe 2024,مصارعه,कुश्ती,डब्लू डब्लू ई,पहलवान,मैच,व्यावसायिक कुश्ती,सुपरस्टार,full match,wwe full match,wwe full segment,wwe full show,wwe show,wwe full ple,wwe highlights,wwe clips,wwe match,wrestling match",17,en,UCJ5v_MCY6GNUBTO8-D3XoAg,WWE
a7HXBKSPmnw,We are all tied up!!!,2026-01-10T03:43:20Z,708307,18737,181,26.0,"wrestling,submission wrestling,wwe,professional wrestling,Combat Sport,finishing moves,कुश्ती,पहलवान,डब्लू डब्लू ई,मैच,सुपरस्टार,व्यावसायिक कुश्ती,مصارعه,Smackdown clips,smackdown highlights,smackdown winners,wwe smackdown highlights today,smackdown tonight,friday night smackdown,wwe smackdown,smackdown 2026,smack downs highlights,cody rhodes,drew mcintyre",17,en,UCJ5v_MCY6GNUBTO8-D3XoAg,WWE
UikleQ9UPfs,"Full NXT New Year's Evil highlights: Jan. 6, 2026",2026-01-07T03:36:03Z,239048,4491,381,622.0,"Ava,Blake Monroe,Fallon Henley,Izzi Dame,Jacy Jayne,Jordynne Grace,Kendal Grey,Niko Vance,Ricky Saints,Shawn Spears,Tatum Paxley,Thea Hail,superstars,world wrestling entertainment,wrestle,wrestler,wrestling,wwe,wwe 2026,مصارعه,कुश्ती,डब्लू डब्लू ई,पहलवान,मैच,व्यावसायिक कुश्ती,सुपरस्टार",17,en,UCJ5v_MCY6GNUBTO8-D3XoAg,WWE
dCgglky_3cQ,Drew McIntyre crawls away NEW WWE Champion,2026-01-10T04:01:52Z,1229391,59419,2239,75.0,"wrestling,submission wrestling,wwe,professional wrestling,Combat Sport,finishing moves,कुश्ती,पहलवान,डब्लू डब्लू ई,मैच,सुपरस्टार,व्यावसायिक कुश्ती,مصارعه,Smackdown clips,smackdown highlights,smackdown winners,wwe smackdown highlights today,smackdown tonight,friday night smackdown,wwe smackdown,smackdown 2026,smack downs highlights,jacob fatu,drew mcintyre,cody rhodes",17,en,UCJ5v_MCY6GNUBTO8-D3XoAg,WWE
dfLdR2fxK5w,Nia Jax and Lash Legend are menaces 😅,2026-01-08T20:00:39Z,1159239,13486,151,19.0,"wrestling,submission wrestling,wwe,professional wrestling,Combat Sport,finishing moves,कुश्ती,पहलवान,डब्लू डब्लू ई,मैच,सुपरस्टार,व्यावसायिक कुश्ती,مصارعه",17,en,UCJ5v_MCY6GNUBTO8-D3XoAg,WWE
Z73DKK6AAUk,"Top 10 SmackDown moments: WWE Top 10, Jan. 2, 2026",2026-01-03T21:06:13Z,311931,6024,282,609.0,"Alexa Bliss,Asuka,Charlotte Flair,Charlotte Flair & Alexa Bliss,IYO SKY,Kabuki Warriors,Kairi Sane,Kit Wilson,Lash Legend,Nia Jax,Rhea Ripley,Sami Zayn,superstars,world wrestling entertainment,wrestle,wrestler,wrestling,wwe,wwe 2024,مصارعه,कुश्ती,डब्लू डब्लू ई,पहलवान,मैच,व्यावसायिक कुश्ती,सुपरस्टार",17,en,UCJ5v_MCY6GNUBTO8-D3XoAg,WWE
A-63zsCPSJ8,The Kabuki Warriors vs. Rhea Ripley & IYO SKY | Title Match: Stranger Things Raw Hype Package,2026-01-05T22:17:18Z,98198,2285,113,85.0,"Asuka,IYO SKY,Kabuki Warriors,Kairi Sane,Rhea Ripley,superstars,world wrestling entertainment,wrestle,wrestler,wrestling,wwe,مصارعه,कुश्ती,डब्लू डब्लू ई,पहलवान,मैच,व्यावसायिक कुश्ती,सुपरस्टार,Raw clips,raw videos,raw highlights,raw winners,monday night raw clips,monday night raw highlights,raw tonight,raw match card,raw highlights this week,WWE on Netflix,WWE Raw on Netflix,Raw on Netflix,wwe 2026",17,en,UCJ5v_MCY6GNUBTO8-D3XoAg,WWE
7434BP29pic,"Hey Randy, why'd you stop? Keep going! 😂",2026-01-09T16:15:01Z,719059,13851,132,34.0,"wrestling,submission wrestling,wwe,professional wrestling,Combat Sport,finishing moves,कुश्ती,पहलवान,डब्लू डब्लू ई,मैच,सुपरस्टार,व्यावसायिक कुश्ती,مصارعه",17,en,UCJ5v_MCY6GNUBTO8-D3XoAg,WWE
dCTijLnjXZw,That wasn't smart Trick...,2026-01-10T01:17:23Z,833784,30051,395,94.0,"wrestling,submission wrestling,wwe,professional wrestling,Combat Sport,finishing moves,कुश्ती,पहलवान,डब्लू डब्लू ई,मैच,सुपरस्टार,व्यावसायिक कुश्ती,مصارعه,Smackdown clips,smackdown highlights,smackdown winners,wwe smackdown highlights today,smackdown tonight,friday night smackdown,wwe smackdown,smackdown 2026,smack downs highlights,trick williams,randy orton",17,en,UCJ5v_MCY6GNUBTO8-D3XoAg,WWE
viV2VNsrfTw,"AJ Styles SLAPS the disrespectful Gunther: Raw highlights, Jan. 5, 2026",2026-01-06T02:08:03Z,597426,15146,1414,209.0,"AJ Styles,Gunther,superstars,world wrestling entertainment,wrestle,wrestler,wrestling,wwe,wwe 2026,مصارعه,कुश्ती,डब्लू डब्लू ई,पहलवान,मैच,व्यावसायिक कुश्ती,सुपरस्टार,Raw clips,raw videos,raw highlights,raw winners,monday night raw clips,monday night raw highlights,raw tonight,raw match card,raw highlights this week,WWE on Netflix,WWE Raw on Netflix,Raw on Netflix",17,en,UCJ5v_MCY6GNUBTO8-D3XoAg,WWE
omrgqfUGHNQ,Drew McIntyre wins the 1st fall...,2026-01-10T03:34:07Z,611121,19126,184,32.0,"wrestling,submission wrestling,wwe,professional wrestling,Combat Sport,finishing moves,कुश्ती,पहलवान,डब्लू डब्लू ई,मैच,सुपरस्टार,व्यावसायिक कुश्ती,مصارعه,Smackdown clips,smackdown highlights,smackdown winners,wwe smackdown highlights today,smackdown tonight,friday night smackdown,wwe smackdown,smackdown 2026,smack downs highlights,drew mcintyre,cody rhodes",17,en,UCJ5v_MCY6GNUBTO8-D3XoAg,WWE
