video_id,title,published_date,view_count,like_count,comment_count,duration,tags,category_id,language,channel_id,channel_name
Bj4GFIht908,Sonu Nigam Live Peformance - #GharkabAaoge | #BORDER2,2026-01-14T17:08:31Z,10273,681,19,44.0,"ghar ka aaoge,border 2 songs,sonu nigam border 2,sandese aate hain,ghar kab aaoge live,sonu nigam live performance,sandeshe aate hain,ghar kab aaoge sonu nigam,ae guzarne wali hawa bata,ghar kab aaoge full song,sonu nigam songs,border 2 song",10,hi,UCq-Fj5jknLsUf-MWSy4_brA,T-Series
uhlthAkCOzQ,Sahana Sahana Song (Lyrics)(Hindi)- The RajaSaab |Prabhas |Nidhhi |Maruthi |Thaman |Vishal M |Kumaar,2026-01-13T09:09:11Z,127102,3074,182,284.0,"hindi songs 2026,hindi songs new,bollywood songs 2026,bollywood movies 2025,tseries,tseries songs,hindi songs,romantic hindi songs,sahana sahana song,rajasaab sahana prabhas,sahana lyrical video,rajasaab prabhas song,sahana sahana prabhas new song,sahana sahana prabhas,prabhas new song,sahana song prabhas,rajasaab movie song,sahana sahana full song lyrics,prabhas sahana sahana,raja saab songs,prabhas new movie,nidhhi agerwal song,sahana sahana",10,hi,UCq-Fj5jknLsUf-MWSy4_brA,T-Series
QPD3OSoKA3Q,BORDER 2: Tara Rum Pum Pum (Audio) | Mithoon | Sukhwinder Singh | Kumaar,2026-01-14T10:04:09Z,55151,2773,178,275.0,"hindi songs 2026,hindi songs new,bollywood songs 2026,bollywood movies 2025,tseries,tseries songs,hindi songs,tara rum pum pum song,border 2 tara rum pum pum,tara rum pum pum full audio song,border 2 tara rum pum,tara rumpum song,border 2 songs,sunny deol songs,border 2 all song,tara rumpum border 2 song,sunny deol border 2,vaurn dhawan border 2,tara rum pum sukhwinder singh,border 2,tara rumpum song border 2,diljit dosanjh song",10,hi,UCq-Fj5jknLsUf-MWSy4_brA,T-Series
dlfXZXdzb_E,Jana Nayagan: Chella Magale (Audio) | Thalapathy Vijay | Pooja Hegde | H Vinoth | Anirudh | KVN,2026-01-09T11:33:09Z,149880,3454,197,233.0,"tamill songs 2026,tamil songs new,tollywood songs 2026,tollywood movies 2025,tseries,tseries songs,tamil songs,jana nayagan song,chella magale song,jana nayagan release date,thalapathy vijay songs,jana nayagan tamil song,chella magale jana nayagan,thalapathy vijay chella magale,chella magale full audio song,thalapathy vijay song,tamil songs thalapathy vijay,thalapathy vijay chella magale song",10,hi,UCq-Fj5jknLsUf-MWSy4_brA,T-Series
uLYTr0ZpSKc,AADAT (Lyrical Video): YO YO HONEY SINGH | AP DHILLON | VAANI KAPOOR | 51 GLORIOUS DAYS | BHUSHAN K,2026-01-13T05:34:43Z,315495,11399,571,239.0,"hindi songs 2026,hindi songs new,bollywood songs 2026,bollywood movies 2025,tseries,tseries songs,aadat full song lyrics,yo yo honey singh aadat song,ap dhillon songs,yo yo honey singh new song,aadat honey singh,ap dhillon aadat song,aadat ap dhillon song,vaani kapoor aadat full song,aadat ap dhillon,ap dhillon new song,aadat full song lryics,ap dhillon song,aadat,ap dhillon songs new",10,hi,UCq-Fj5jknLsUf-MWSy4_brA,T-Series
fCcgZhPQHyk,Sonu Nigam & Manoj Muntashir made everyone emotional with #MittiKeBete | #BORDER2,2026-01-14T16:42:13Z,59111,504,17,47.0,"mitti ke bete,border 2 mitti ke bete,border2 mitti ke bete live,border 2 album launch,sonu nigam mitti ke bete,sonu nigam live mitti ke bete,miti ke bete,sonu nigam live performance,border 2 song,sonu nigam border 2 song",10,hi,UCq-Fj5jknLsUf-MWSy4_brA,T-Series
z52kTtHAvSQ,I Love You 8K Full Song | Salman Khan | Kareena Kapoor Khan | Bodyguard | Pritam | Ash King,2026-01-07T11:02:25Z,31009,651,50,259.0,"hindi songs new,bollywood songs 2026,bollywood movies 2025,tseries,tseries songs,hindi songs,romantic hindi songs,i love you song,bodyguard i love you,salman khan i love you song,bodyguard movie i love you song,salman khan i love you full song,body guard salman khan song,i love you ash king,bodyguard movie songs,i love you song full,bollywood romantic songs,salman khan songs,i love you salman khan song,bodyguard movie,salman khan songs old",24,hi,UCq-Fj5jknLsUf-MWSy4_brA,T-Series
L2KbAlc3XLQ,Andhra King Taluka (Audio Jukebox) Hindi | Ram Pothineni | Upendra | Bhagyashri | Vivek–Mervin,2026-01-13T15:39:46Z,8500,178,42,1161.0,"hindi songs 2026,hindi songs new,bollywood songs 2026,bollywood movies 2025,tseries,tseries songs,hindi songs,andhra king taluka audio jukebox,andhra king taluka full audio jukebox,andhra king taluka ram pothineni,ram pothineni movie song,upendra songs,andhra king taluka ram pothineni song,upendra andhra king taluka song",10,hi,UCq-Fj5jknLsUf-MWSy4_brA,T-Series
da1rtWF4CMY,Andhra King Taluka: Dil Ye Chotta Sa - Hindi(Audio)|Ram Pothineni |Upendra |Bhagyashri |Vivek-Mervin,2026-01-13T14:01:13Z,7684,211,27,171.0,"hindi songs 2026,hindi songs new,bollywood songs 2026,bollywood movies 2025,tseries,tseries songs,hindi songs,romantic hindi songs,hindi songs bollywood,hindi song,song,Dil Ye Chotta Sa song,Dil Ye Chotta Sa official audio,romantic soft Hindi song,cute love song,melodic Hindi music,PVNS Rohith songs,Sindhuja Srinivasan vocals,indie Hindi love song,heartwarming romantic song,new love songs 2026,Bhagyashri romantic song,emotional love track",10,hi,UCq-Fj5jknLsUf-MWSy4_brA,T-Series
8gW1jrjuBoc,"“Likho Kab Aaoge” ✍️🥺🇮🇳 - Sunny Deol | Varun Dhawan, Diljit D, Ahan S | Ghar Kab Aaoge | BORDER 2",2026-01-06T07:27:44Z,1192376,27598,237,25.0,"sandese aate hain,ghar kab aaoge,sandeshe aate hain,ghar kab aaoge border 2,sandese aate hai sonu nigam,ghar kab aaoge arijit singh,sonu nigam border 2 song,ghar kab aaoge sunny deol,border 2 sunny deol,ghar kab aaoge full song,arijit singh ghar kab aaoge,sonu nigam ghar kab aaoge,vishal mishra ghar kab aaoge,diljit dosanjh ghar kab aaoge,border 2 ghar kab aaoge",10,hi,UCq-Fj5jknLsUf-MWSy4_brA,T-Series
5ApUxvUN4QI,Andhra King Taluka: Tukur Tukur Dekhle - Hindi (Audio) | Ram Pothineni | Upendra | Vivek-Mervin,2026-01-13T14:01:13Z,7849,132,40,193.0,"hindi songs 2026,hindi songs new,bollywood songs 2026,bollywood movies 2025,tseries,tseries songs,hindi songs,hindi songs bollywood,hindi song status,hindi song,song,Tukur Tukur Dekhle song,Tukur Tukur Dekhle music video,playful Hindi song,flirty romantic song,Aditya Iyengar Hindi song,fun love song,catchy hook song,viral reel song,trending Hindi music 2026,dance friendly song,Bhagyashri cute song,Ram Pothineni romantic moments",10,hi,UCq-Fj5jknLsUf-MWSy4_brA,T-Series
EeAEDuptR8I,"BORDER 2: Mohabbat Ho Gayi Hai (Audio) | Anu Malik, Javed A, Mithoon, Manoj M, Sonu Nigam, Palak M",2026-01-14T10:03:53Z,111665,5529,508,361.0,"hindi songs 2026,hindi songs new,bollywood songs 2026,bollywood movies 2025,tseries,tseries songs,mohabbat ho gayi hai full audio song,border 2 mohabbat ho gayi hai,border song,mohabbat hogayi hai,border 2 song,sunny deol song,mohabbat hogyi h,sonu nigam mohabbat hogyi hai,palak muchchal mohabbat ho gayi hai,border 2 mohabbat ho gayi h,mohabat ho gayi hai song,sonu nigam songs,border 2 song all,sonu nigam border 2 song",10,hi,UCq-Fj5jknLsUf-MWSy4_brA,T-Series
7h0aEsmg_SE,"BORDER 2 (Full Album): Sunny Deol |Anu Malik,Mithoon,Vishal Mishra,Sachet-Parampara,Gurmoh|Bhushan K",2026-01-14T09:32:09Z,125229,9514,5149,3053.0,"hindi songs 2026,hindi songs new,bollywood songs 2026,bollywood movies 2025,tseries,tseries songs,hindi songs,border 2 full album,sunny deol border 2,border 2 all songs,varun dhawan border 2,border 2 all song,ahan shetty border 2,border 2 full album song,diljit dosanjh border 2,border 2 songs,arijti singh song border 2,border 2 movie,sunny deol border 2 movie,varun dhawan border 2 movie,border 2 movie album song,patriotic songs all,border 2 song",10,hi,UCq-Fj5jknLsUf-MWSy4_brA,T-Series
oH81OGjRy8g,Roop Kumar Rathod and Vishal Mishra Singing together #jaatehuelamhon 🔥| #border2,2026-01-14T18:33:59Z,53852,1255,15,49.0,"jaate hue lamhon song,jaate hue lamhon border 2,vishal mishra border 2,roop kumar rathod border 2",10,hi,UCq-Fj5jknLsUf-MWSy4_brA,T-Series
n4D8uPyXH1M,The RajaSaab (Audio Jukebox) (Hindi) | Prabhas | Sanjay Dutt | Nidhhi Agerwal | Thaman S | Maruthi,2026-01-09T15:05:17Z,26529,527,65,947.0,"hindi songs 2026,hindi songs new,bollywood songs 2026,bollywood movies 2025,tseries,tseries songs,hindi songs,rajasaab movie songs,prabhas rajasaab song,the rajasaab prabhas song,rajasaab sanjay dutt,the rajasaab song,prabhas new movie,rajasaab prabhas movie,prabhas movie songs,rajasaab songs,prabhas new movie song,rajasaab prabhas song,rajasaab movie song,prabhas new movie songs hindi",10,hi,UCq-Fj5jknLsUf-MWSy4_brA,T-Series
hkJv9GsMW7Y,Vishal Mishra😍 lighten up the sky with romance while singing #PyaariLage | #BORDER2,2026-01-14T16:50:36Z,6413,349,12,45.0,"pyaari lage,border 2 pyaari lage,border 2 song pyari lage,vishal mishra border 2 song,vishal mishra live performance,pyaari lage vishal mishra,border 2 song,vishal mishra live singing,border 2 songs",10,hi,UCq-Fj5jknLsUf-MWSy4_brA,T-Series
3YF1gD_5FKs,#JaateHueLamhon by Vishal Mishra | #BORDER2,2026-01-14T17:57:47Z,44233,416,12,49.0,"jaate hue lamhon,border 2 songs,border 2 album launch,vishal mishra border 2,ae jaate hue lamhon live,vishal mishra jaate hue lamhon,border 2 jaate hue lamhon,vishal mishra live performance",10,hi,UCq-Fj5jknLsUf-MWSy4_brA,T-Series
Pf_ajlnLPjA,Grow the Melon Then Slice It! 🍈 Count the Pieces!,2026-01-05T12:00:51Z,1995283,15334,0,23.0,"cocomelon,abckidtv,nursery rhymes,children songs,baby songs,kid songs,sing-along,sing-along songs,kids videos,kids animation,kids entertainment,kids education,preschool,kindergarten,toddler,JJ",27,en-US,UCbCmjCuTUZos6Inko4u57UQ,Cocomelon - Nursery Rhymes
4LhhNdAkAx0,Make Your Own Baby Cody! ✂️🧡 Kids DIY Craft! 🎨,2026-01-06T12:00:09Z,2880741,23548,0,16.0,"cocomelon,abckidtv,nursery rhymes,children songs,baby songs,kid songs,sing-along,sing-along songs,kids videos,kids animation,kids entertainment,kids education,preschool,kindergarten,toddler,JJ",27,en-US,UCbCmjCuTUZos6Inko4u57UQ,Cocomelon - Nursery Rhymes
4bzMwTncw_4,Build a Bubble Bear 🫧🐻 One Bubble at a Time!,2026-01-04T12:00:14Z,9519070,54355,0,21.0,"cocomelon,abckidtv,nursery rhymes,children songs,baby songs,kid songs,sing-along,sing-along songs,kids videos,kids animation,kids entertainment,kids education,preschool,kindergarten,toddler,JJ",27,en-US,UCbCmjCuTUZos6Inko4u57UQ,Cocomelon - Nursery Rhymes
jQZkvdb2geY,Peekaboo Song with Dad & JJ | Let's Move with CoComelon Nursery Rhymes & Kids Songs,2026-01-06T08:00:56Z,3000526,4813,0,164.0,"JJ,abckidtv,baby songs,children songs,cocomelon,kid songs,kids animation,kids education,kids entertainment,kids videos,kindergarten,nursery rhymes,preschool,sing-along,sing-along songs,toddler,peekaboo,songs for kids,classic songs of kids,peekaboo song,peekaboo game,hide and seak",24,en,UCbCmjCuTUZos6Inko4u57UQ,Cocomelon - Nursery Rhymes
HckP6kodfU8,The Tortoise and the Hare + Three Little Pigs! | CoComelon Nursery Rhymes & Kids Songs,2026-01-03T08:00:32Z,2731319,3813,0,425.0,"JJ,abckidtv,baby songs,children songs,cocomelon,kid songs,kids animation,kids education,kids entertainment,kids videos,kindergarten,nursery rhymes,preschool,sing-along,sing-along songs,toddler,The Tortoise and the Hare,Three Little Pigs V1,classic nursery rhymes for kids",24,en,UCbCmjCuTUZos6Inko4u57UQ,Cocomelon - Nursery Rhymes
aer1Eo90LR4,Look Up! 🙄⬆️ Where'd the Dough Go?,2026-01-09T12:00:03Z,1608820,10305,0,14.0,"cocomelon,abckidtv,nursery rhymes,children songs,baby songs,kid songs,sing-along,sing-along songs,kids videos,kids animation,kids entertainment,kids education,preschool,kindergarten,toddler,JJ",27,en-US,UCbCmjCuTUZos6Inko4u57UQ,Cocomelon - Nursery Rhymes
z91AZe3toFA,Z is for Zoom! 🏎️🏃🏻 Learn ABC! #shorts #cocomelon,2026-01-03T12:01:51Z,4162144,30650,0,24.0,"cocomelon,abckidtv,nursery rhymes,children songs,baby songs,kid songs,sing-along,sing-along songs,kids videos,kids animation,kids entertainment,kids education,preschool,kindergarten,toddler,JJ",27,en-US,UCbCmjCuTUZos6Inko4u57UQ,Cocomelon - Nursery Rhymes
GknGVPhqTKM,Wheels on the Bus Dance REMIX! 🚌🎶 Kids Dance Party!,2026-01-08T12:00:29Z,1867874,16861,0,31.0,"cocomelon,abckidtv,nursery rhymes,children songs,baby songs,kid songs,sing-along,sing-along songs,kids videos,kids animation,kids entertainment,kids education,preschool,kindergarten,toddler,JJ",27,en-US,UCbCmjCuTUZos6Inko4u57UQ,Cocomelon - Nursery Rhymes
xi1SbijmrUQ,Sort the Fruits by Color! 🍎🟢🟡🟠 Kids Learning Game,2026-01-11T12:02:00Z,993402,9472,0,54.0,"cocomelon,abckidtv,nursery rhymes,children songs,baby songs,kid songs,sing-along,sing-along songs,kids videos,kids animation,kids entertainment,kids education,preschool,kindergarten,toddler,JJ",27,en-US,UCbCmjCuTUZos6Inko4u57UQ,Cocomelon - Nursery Rhymes
SlhvKr74MHo,CoComelon Dance Favourites! Kitchen Dance + Belly Button Song | Move with CoComelon Nursery Rhymes,2026-01-08T08:00:42Z,590247,1452,0,1945.0,"JJ,abckidtv,baby songs,children songs,cocomelon,kid songs,kids animation,kids education,kids entertainment,kids videos,kindergarten,nursery rhymes,preschool,sing-along,sing-along songs,toddler,baby animal dance,cocomelon baby animals,animals cocomelon,kids animals cocomelon,cocomelon friends,cocomelon animals,cocomelon family,learn about animals,dance songs,baby coco,Kitchen",24,en,UCbCmjCuTUZos6Inko4u57UQ,Cocomelon - Nursery Rhymes
2l7Lfn-1kps,Five Little Speckled Frogs | Learn Numbers with CoComelon Nursery Rhymes & Kids Songs,2026-01-10T08:00:04Z,1437113,2109,0,349.0,"JJ,abckidtv,baby songs,children songs,cocomelon,kid songs,kids animation,kids education,kids entertainment,kids videos,kindergarten,nursery rhymes,preschool,sing-along,sing-along songs,toddler,Five Little Speckled Frogs,Five Little Ducks,5 little,animals for kids,ducks,farm animals",24,en,UCbCmjCuTUZos6Inko4u57UQ,Cocomelon - Nursery Rhymes
XX1v7RKXSIs,Knock Knock Who's There? It's GIANT BINGO!!! 🐶😮,2026-01-10T12:01:04Z,1565943,12132,0,22.0,"cocomelon,abckidtv,nursery rhymes,children songs,baby songs,kid songs,sing-along,sing-along songs,kids videos,kids animation,kids entertainment,kids education,preschool,kindergarten,toddler,JJ",27,en-US,UCbCmjCuTUZos6Inko4u57UQ,Cocomelon - Nursery Rhymes
Dxw1iHxQlOw,Oh No! The Wheel Fell Off! 🚗😲 Can YOU Fix It?,2026-01-14T12:00:35Z,580199,3773,0,18.0,"cocomelon,abckidtv,nursery rhymes,children songs,baby songs,kid songs,sing-along,sing-along songs,kids videos,kids animation,kids entertainment,kids education,preschool,kindergarten,toddler,JJ",27,en-US,UCbCmjCuTUZos6Inko4u57UQ,Cocomelon - Nursery Rhymes
2E0hHjSwdW4,Bingo | @CoComelon Nursery Rhymes & Kids Songs,2018-02-21T08:00:01Z,1670412922,3900301,0,181.0,"kids entertainment,JJ,cocomelon,abckidtv,toddler,kids videos,sing-along,kids animation,kid songs,baby songs,kids education,kindergarten,children songs,preschool,nursery rhymes,sing-along songs",27,en,UCbCmjCuTUZos6Inko4u57UQ,Cocomelon - Nursery Rhymes
vdhW5ES5DPo,Yummy Peas Song | Fruit & Vegetables for Kids | CoComelon Nursery Rhymes & Kids Songs,2026-01-13T08:01:19Z,921482,2143,0,164.0,"JJ,abckidtv,baby songs,children songs,cocomelon,kid songs,kids animation,kids education,kids videos,kindergarten,nursery rhymes,preschool,sing-along,sing-along songs,toddler,cocomelon friends,cody cocomelon,dad and cody cocomelon,fruits and vegetables,fruits and vegetables for kids,healthy eating for kids,healthy eating song,yes yes,yes yes fruits,yes yes fruits song,yes yes song,yes yes vegetables,yes yes vegetables cocomelon,Peas Song",24,en,UCbCmjCuTUZos6Inko4u57UQ,Cocomelon - Nursery Rhymes
PMYLf9nhQxc,Stacking Toy Blocks 🟥🟧🟨🟩🟦,2026-01-12T12:01:01Z,1074598,9066,0,13.0,"cocomelon,abckidtv,nursery rhymes,children songs,baby songs,kid songs,sing-along,sing-along songs,kids videos,kids animation,kids entertainment,kids education,preschool,kindergarten,toddler,JJ",27,en-US,UCbCmjCuTUZos6Inko4u57UQ,Cocomelon - Nursery Rhymes
9AQE3bIC2WI,MasterChef India | Mon-Fri At 9:00 PM | Only On SET & Sony LIV,2026-01-07T07:27:40Z,771364,11800,76,84.0,,24,en-IN,UCpEhnqL0y41EpW2TvWAHD7Q,SET India
WpkOYdMEiq4,MasterChef India | Mon-Fri At 9:00 PM | Only On SET & Sony LIV,2026-01-07T07:18:15Z,193580,1196,14,12.0,,24,en-IN,UCpEhnqL0y41EpW2TvWAHD7Q,SET India
SDrLg1vHEqA,'Hoga Tumse' सुनकर हुई Padmini जी की यादें ताज़ा | Indian Idol S16 | Viral Performance Of The Week,2026-01-09T12:45:04Z,35567,367,11,1075.0,"indian idol performance,indian idol singers,indian idol judges,vishal dadlani,singing reality show,indian idol seasons on sony,indian idol new season,indian idol 2025,indian idol,singing shows india,Vishal Dadlani,Shreya Ghoshal,Indian idol contestants,Indian Idol season 16,Indian Idol new season S16,season 16,Badshah indian idol,auditions 2025,season S16 audition round,indian idol season 16 latest episode,Indian Idol S16,indian idol latest performance",24,en-IN,UCpEhnqL0y41EpW2TvWAHD7Q,SET India
IPybv8iUiCY,"NEW! Indian Idol S16 - With Poonam Dhillon, Padmini Kolhapure | Ep 23 | 3 Jan 2026 | Teaser",2026-01-03T16:00:25Z,181630,1439,74,669.0,"indian idol performance,indian idol singers,indian idol judges,vishal dadlani,singing reality show,indian idol seasons on sony,indian idol new season,indian idol 2025,indian idol,singing shows india,Vishal Dadlani,Shreya Ghoshal,Indian idol contestants,Indian Idol season 16,Indian Idol new season S16,season 16,Badshah indian idol,auditions 2025,season S16 audition round,indian idol season 16 latest episode,Indian Idol S16,indian idol teaser episode 20",24,en-IN,UCpEhnqL0y41EpW2TvWAHD7Q,SET India
p9WBBjdI5jc,'Jhutha Hi Sahi' गाकर Dipan ने किया Kumar Sanu को Impress | Indian Idol S14 | Bollywood Nonstop,2026-01-13T14:30:57Z,3660,15,1,1169.0,"indian idol performance,indian idol singers,indian idol judges,vishal dadlani,singing reality show,indian idol seasons on sony,indian idol new season,indian idol 2024,indian idol,singing shows india,Vishal Dadlani,Shreya Ghoshal,Indian idol contestants,Indian Idol season 15,Indian Idol new season S 15,season 15,Badshah indian idol,auditions 2024,season S15 audition round,indian idol season 15 latest episode,Indian Idol S15,Indian Idol S15 Ep",24,en-IN,UCpEhnqL0y41EpW2TvWAHD7Q,SET India
g85jwgSae4A,'M Bole To' पर Vaibhav के Vocals ने किया Sanjay Dutt को Impress |Indian Idol S14 | Bollywood Nonstop,2026-01-11T14:30:40Z,4150,33,4,1283.0,"indian idol performance,indian idol singers,indian idol judges,vishal dadlani,singing reality show,indian idol seasons on sony,indian idol new season,indian idol 2024,indian idol,singing shows india,Vishal Dadlani,Shreya Ghoshal,Indian idol contestants,Indian Idol season 15,Indian Idol new season S 15,season 15,Badshah indian idol,auditions 2024,season S15 audition round,indian idol season 15 latest episode,Indian Idol S15,Indian Idol S15 Ep",24,en-IN,UCpEhnqL0y41EpW2TvWAHD7Q,SET India
vco2M06eYis,'What Is Mobile Number' पर Anshika के Outstanding Vocals | Indian Idol S16 | Anshika Special,2026-01-13T06:15:04Z,13433,101,2,856.0,"indian idol performance,indian idol singers,indian idol judges,vishal dadlani,singing reality show,indian idol seasons on sony,indian idol new season,indian idol 2025,indian idol,singing shows india,Vishal Dadlani,Shreya Ghoshal,Indian idol contestants,Indian Idol season 16,Indian Idol new season S16,season 16,Badshah indian idol,auditions 2025,season S16 audition round,indian idol season 16 latest episode,Indian Idol S16,indian idol latest performance",24,en-IN,UCpEhnqL0y41EpW2TvWAHD7Q,SET India
K_sYKgLrS5o,Muqabala पर ये Performance Judges को लगी Amazing! | India’s Got Talent Season 11 | Malaika Special,2026-01-13T08:00:25Z,6974,34,2,323.0,"set reality shows,new set show,set india latest show,India's Got Talent Season 11,TaIent Show,India's Got Talent,Navjot singh sidhu,Shaan Mukherjee,Malaika Arora,Harsh Limbachiyaa,india's got talent new season,talent shows on sony,new reality show,indias got talent 2025,india's got talent season 11 auditions,india's got talent performances,indias got talent viral videos,Best Of India's Got Talent,Sidhu Viral shayri,India's Got Talent teaser episode 27",24,en-IN,UCpEhnqL0y41EpW2TvWAHD7Q,SET India
q5GEP6JFfVM,Shreya की Request पर Suresh जी ने गाया 'Aye Zindagi' | Indian Idol S16 | Best Moments,2026-01-14T03:30:46Z,4371,35,2,426.0,"indian idol performance,indian idol singers,indian idol judges,vishal dadlani,singing reality show,indian idol seasons on sony,indian idol new season,indian idol 2025,indian idol,singing shows india,Vishal Dadlani,Shreya Ghoshal,Indian idol contestants,Indian Idol season 16,Indian Idol new season S16,season 16,Badshah indian idol,auditions 2025,season S16 audition round,indian idol season 16 latest episode,Indian Idol S16,indian idol latest performance",24,en-IN,UCpEhnqL0y41EpW2TvWAHD7Q,SET India
m5K5zOpokKY,'Kabhi Tu Chhalia Lagta Hai' पर Ankita ने दिया एक Sweet Performance |Indian Idol S16 |Ankita Special,2026-01-12T06:15:04Z,16939,126,4,841.0,"indian idol performance,indian idol singers,indian idol judges,vishal dadlani,singing reality show,indian idol seasons on sony,indian idol new season,indian idol 2025,indian idol,singing shows india,Vishal Dadlani,Shreya Ghoshal,Indian idol contestants,Indian Idol season 16,Indian Idol new season S16,season 16,Badshah indian idol,auditions 2025,season S16 audition round,indian idol season 16 latest episode,Indian Idol S16,indian idol latest performance",24,en-IN,UCpEhnqL0y41EpW2TvWAHD7Q,SET India
_6E_2zgw-7k,"NEW! Indian Idol S16 - With Jaya Prada, Reena Roy | Ep 26 | 11 Jan 2026 | Teaser",2026-01-11T16:01:01Z,100460,823,54,507.0,"indian idol performance,indian idol singers,indian idol judges,vishal dadlani,singing reality show,indian idol seasons on sony,indian idol new season,indian idol 2025,indian idol,singing shows india,Vishal Dadlani,Shreya Ghoshal,Indian idol contestants,Indian Idol season 16,Indian Idol new season S16,season 16,Badshah indian idol,auditions 2025,season S16 audition round,indian idol season 16 latest episode,Indian Idol S16,indian idol teaser episode 26",24,en-IN,UCpEhnqL0y41EpW2TvWAHD7Q,SET India
3P-1V5T3cFM,Aditya ने बिगाड़ा Anshika का नाम | Indian Idol S16 | Best Moments,2026-01-13T10:30:06Z,11002,113,8,482.0,"indian idol performance,indian idol singers,indian idol judges,vishal dadlani,singing reality show,indian idol seasons on sony,indian idol new season,indian idol 2025,indian idol,singing shows india,Vishal Dadlani,Shreya Ghoshal,Indian idol contestants,Indian Idol season 16,Indian Idol new season S16,season 16,Badshah indian idol,auditions 2025,season S16 audition round,indian idol season 16 latest episode,Indian Idol S16,indian idol latest performance",24,en-IN,UCpEhnqL0y41EpW2TvWAHD7Q,SET India
eunAPI9gUOM,'Main Albeli' पर Vaishnavi & Shivanshu ने दी उम्दा Performance |India's Best Dancer 4|New Year Party,2026-01-12T08:30:32Z,4201,15,4,859.0,"india's best dancer season 4,ibd performances,india's best dancer new show,ibd 2024,india's best dancer clip,new dance show,set india dance show,dance reality shows,dance performances,dance guru geeta,dance shows audition 2024,new set dance show,set india,dance guru terence,इंडिया'ज़् बेस्ट डॅन्सर,new show on SET India,ibd 4,geeta kapur,terence lewis,Karisma Kapoor,dance with choreographers,IBD latest episode,nepo & vartika special",24,en-IN,UCpEhnqL0y41EpW2TvWAHD7Q,SET India
J6YY27lEMOQ,'Sona Kitna Sona Hai' पर Shreya का Power Packed Performance | Indian Idol S16 | Shreya Special,2026-01-14T06:15:03Z,13734,112,6,707.0,"indian idol performance,indian idol singers,indian idol judges,vishal dadlani,singing reality show,indian idol seasons on sony,indian idol new season,indian idol 2025,indian idol,singing shows india,Vishal Dadlani,Shreya Ghoshal,Indian idol contestants,Indian Idol season 16,Indian Idol new season S16,season 16,Badshah indian idol,auditions 2025,season S16 audition round,indian idol season 16 latest episode,Indian Idol S16,indian idol latest performance",24,en-IN,UCpEhnqL0y41EpW2TvWAHD7Q,SET India
-PuPdKBPQSU,Adya के Vocals पर Judges को हुआ Proud Feel | Indian Idol S14 | Party All Night,2026-01-10T13:45:00Z,6146,46,5,835.0,"indian idol performance,indian idol singers,indian idol judges,vishal dadlani,singing reality show,indian idol seasons on sony,indian idol new season,indian idol 2024,indian idol,singing shows india,Vishal Dadlani,Shreya Ghoshal,Indian idol contestants,Indian Idol season 15,Indian Idol new season S 15,season 15,Badshah indian idol,auditions 2024,season S15 audition round,indian idol season 15 latest episode,Indian Idol S15",24,en-IN,UCpEhnqL0y41EpW2TvWAHD7Q,SET India
bESk8V3rWFU,MasterChef India | Mon-Fri At 9:00 PM | Only On SET & Sony LIV,2026-01-07T07:32:47Z,438892,4891,19,58.0,,24,en-IN,UCpEhnqL0y41EpW2TvWAHD7Q,SET India
zD6fOgUqtSk,'Khwaja Mere Khwaja' पर Obom के Vocals पर आया Judges का दिल | Indian Idol S14 | Bollywood Nonstop,2026-01-14T14:31:03Z,4383,25,2,1277.0,"indian idol performance,indian idol singers,indian idol judges,vishal dadlani,singing reality show,indian idol seasons on sony,indian idol new season,indian idol 2024,indian idol,singing shows india,Vishal Dadlani,Shreya Ghoshal,Indian idol contestants,Indian Idol season 15,Indian Idol new season S 15,season 15,Badshah indian idol,auditions 2024,season S15 audition round,indian idol season 15 latest episode,Indian Idol S15,Indian Idol S15 Ep",24,en-IN,UCpEhnqL0y41EpW2TvWAHD7Q,SET India
